{
  "$schema": "https://json-schema.org/draft/2020-12/schema",
  "$id": "https://github.com/philoserf/ctworldgen/docs/record.schema.json",
  "title": "Classic Traveller star map record",
  "description": "A star map generated from Book 3 Worlds and Adventures pp. 1-12: either the p. 3 sub-sector grid, or the sector of sixteen of them (ERRATA E006). This schema describes the record the engine writes at milestone 5: the world occurrence scan and the broad areas of p. 1 it was made under, starport types, naval and scout bases, routes, and the eight characteristics of every world. It grows with each milestone that adds fields, all of it at schema_version 1, because pre-release growth invalidates no released record.",
  "type": "object",
  "additionalProperties": false,
  "required": [
    "schema_version",
    "ruleset",
    "engine_version",
    "rng_algorithm",
    "seed",
    "errata",
    "name",
    "occurrence_dm",
    "worlds",
    "routes"
  ],
  "properties": {
    "schema_version": {
      "description": "The shape of the record. Bumps when a constraint would invalidate a record the current engine writes.",
      "type": "integer",
      "const": 1
    },
    "ruleset": {
      "description": "The held pages that govern.",
      "type": "string",
      "const": "ct-1977-book3-pp1-12"
    },
    "engine_version": {
      "description": "Bumps for a rule change, a change to dice-stream consumption order, or a change to the RNG construction, and for nothing else.",
      "type": "string",
      "minLength": 1
    },
    "rng_algorithm": {
      "type": "string",
      "const": "go-math-rand-v2-pcg"
    },
    "seed": {
      "description": "Fills both words of the PCG state, so this one field reproduces the stream. A seed the engine drew is at most 2^53-1 so that a reader parsing JSON numbers as doubles cannot round it; an explicit --seed may be any uint64.",
      "type": "integer",
      "minimum": 0
    },
    "errata": {
      "description": "The readings that actually governed this record, in document order. Each entry in ERRATA.md states its own stamping condition.",
      "type": "array",
      "items": { "type": "string", "pattern": "^E[0-9]{3}$" },
      "uniqueItems": true
    },
    "name": {
      "type": "string"
    },
    "notes": {
      "description": "The referee's own note about the map as a whole. Never generated and never read back; absent from a record that has none (issue 1 #6).",
      "type": "string"
    },
    "occurrence_dm": {
      "description": "The referee's world occurrence DM (p. 1), applied to every hex no broad area covers. With no broad areas that is the whole subsector, which is the only form the tool wrote before ERRATA E012.",
      "type": "integer",
      "minimum": -1,
      "maximum": 1
    },
    "occurrence_areas": {
      "description": "The broad areas of p. 1: rectangles of the grid's own numbering, each with its own occurrence DM overriding occurrence_dm where it lies (ERRATA E012). Absent from a record with none, which is what keeps such a record identical to what the tool wrote before this field existed. Two things this schema cannot state and starmap.Decode enforces instead: the corners are the low and the high hex, and no two areas may overlap -- p. 1 gives no basis for combining two DMs.",
      "type": "array",
      "minItems": 1,
      "items": { "$ref": "#/$defs/area" }
    },
    "grid": {
      "description": "The hex grid the hexes below are numbered on: 8x10 for the p. 3 sub-sector grid, 32x40 for a sector of sixteen of them (ERRATA E006). A record written before grids were recorded has none, and is a sub-sector. The pair is what is named, not the two dimensions separately -- 8x40 and 32x10 are grids nothing prints and starmap.Decode refuses, so the oneOf below is what keeps the schema from accepting a record the reader rejects.",
      "type": "object",
      "additionalProperties": false,
      "required": ["columns", "rows"],
      "properties": {
        "columns": { "type": "integer", "enum": [8, 32] },
        "rows": { "type": "integer", "enum": [10, 40] }
      },
      "oneOf": [
        {
          "properties": { "columns": { "const": 8 }, "rows": { "const": 10 } }
        },
        {
          "properties": { "columns": { "const": 32 }, "rows": { "const": 40 } }
        }
      ]
    },
    "worlds": {
      "type": "array",
      "items": { "$ref": "#/$defs/world" }
    },
    "routes": {
      "description": "The commercial routes of p. 2, in ascending hex number of the first world and then of the second (ERRATA E003).",
      "type": "array",
      "items": { "$ref": "#/$defs/route" }
    }
  },
  "$defs": {
    "world": {
      "type": "object",
      "additionalProperties": false,
      "required": [
        "hex",
        "name",
        "starport",
        "naval_base",
        "scout_base",
        "size",
        "atmosphere",
        "hydrographics",
        "population",
        "government",
        "law_level",
        "tech_index",
        "digits"
      ],
      "properties": {
        "hex": {
          "description": "The four-digit column-and-row number the p. 3 grid prints. 0101 through 0810 on a sub-sector grid; up to 3240 on a sector grid (ERRATA E006). The record's grid says which.",
          "type": "string",
          "pattern": "^(0[1-9]|[12][0-9]|3[0-2])(0[1-9]|[1-3][0-9]|40)$"
        },
        "name": {
          "description": "Always empty: p. 12 step 3 says to name each world and prints no table, so the hex identifies it.",
          "type": "string"
        },
        "notes": {
          "description": "The referee's own note about this world. Never generated and never read back; absent from a world that has none (issue 1 #6).",
          "type": "string"
        },
        "starport": {
          "type": "string",
          "enum": ["A", "B", "C", "D", "E", "X"]
        },
        "naval_base": {
          "description": "The p. 5 chart prints a naval base throw at starports A and B only; elsewhere this is false without a throw having been made.",
          "type": "boolean"
        },
        "scout_base": {
          "description": "The p. 5 chart prints a scout base throw at starports A through D; elsewhere this is false without a throw having been made.",
          "type": "boolean"
        },
        "size": {
          "description": "2D-2 (pp. 4, 12). Zero is an asteroid/planetoid complex.",
          "type": "integer",
          "minimum": 0,
          "maximum": 10
        },
        "atmosphere": {
          "description": "2D-7 + size; automatically 0 at size 0, with no die thrown (R13). Nothing caps it at the p. 5 table's last row: a value no table names is a gap in the table, not a bound on the throw (ERRATA E004).",
          "type": "integer",
          "minimum": 0,
          "maximum": 15
        },
        "hydrographics": {
          "description": "2D-7 + size, with a further DM of -4 if the atmosphere is 0, 1, or greater than 9; automatically 0 at size 0 or 1, with no die thrown (R13).",
          "type": "integer",
          "minimum": 0,
          "maximum": 15
        },
        "population": {
          "description": "2D-2, an exponent of 10 (pp. 8, 12).",
          "type": "integer",
          "minimum": 0,
          "maximum": 10
        },
        "government": {
          "description": "2D-7 + population (pp. 8, 12).",
          "type": "integer",
          "minimum": 0,
          "maximum": 15
        },
        "law_level": {
          "description": "2D-7 + government (pp. 8, 12). Government feeds this already floored.",
          "type": "integer",
          "minimum": 0,
          "maximum": 20
        },
        "tech_index": {
          "description": "One die plus the sum of the p. 9 matrix DMs. The one value the book prints a range for rather than a table that happens to end: zero to 18 (p. 9).",
          "type": "integer",
          "minimum": 0,
          "maximum": 18
        },
        "digits": {
          "description": "The string of digits of p. 4: the starport type and the seven characteristics, eight characters, nothing between them. The familiar hyphen is not in the held text (ERRATA E005). The alphabet is Book 1 p. 8's hexadecimal extended by Book 3 p. 2's letters, omitting O and I.",
          "type": "string",
          "pattern": "^[ABCDEX][0-9A-HJ-NP-Z]{7}$"
        },
        "clamps": {
          "description": "The floor or the cap that actually bound, absent where nothing did. Raw is the one thing here that cannot be recomputed from a value.",
          "type": "array",
          "minItems": 1,
          "items": { "$ref": "#/$defs/clamp" }
        }
      }
    },
    "area": {
      "type": "object",
      "additionalProperties": false,
      "required": ["from", "to", "dm"],
      "properties": {
        "from": {
          "description": "The low corner of the rectangle: its least column and its least row.",
          "type": "string",
          "pattern": "^(0[1-9]|[12][0-9]|3[0-2])(0[1-9]|[1-3][0-9]|40)$"
        },
        "to": {
          "description": "The high corner. A rectangle of the grid's numbering rather than a geometric one: p. 3 sets the even-numbered columns half a hex low, so the drawn shape has a ragged edge.",
          "type": "string",
          "pattern": "^(0[1-9]|[12][0-9]|3[0-2])(0[1-9]|[1-3][0-9]|40)$"
        },
        "dm": {
          "description": "The occurrence DM inside this area. The same three values p. 1 offers for the whole subsector, because the page states one rule for both.",
          "type": "integer",
          "minimum": -1,
          "maximum": 1
        }
      }
    },
    "clamp": {
      "type": "object",
      "additionalProperties": false,
      "required": ["characteristic", "raw", "value"],
      "properties": {
        "characteristic": {
          "description": "Starport is not among them: it is a table lookup and never arithmetic, so it can never be clamped.",
          "type": "string",
          "enum": [
            "size",
            "atmosphere",
            "hydrographics",
            "population",
            "government",
            "law_level",
            "tech_index"
          ]
        },
        "raw": { "type": "integer" },
        "value": { "type": "integer", "minimum": 0 }
      }
    },
    "route": {
      "type": "object",
      "additionalProperties": false,
      "required": ["from", "to", "distance"],
      "properties": {
        "from": {
          "description": "The lower hex identifier of the pair. A route is not directed; ordering the pair is what keeps one route from being written two ways.",
          "type": "string",
          "pattern": "^(0[1-9]|[12][0-9]|3[0-2])(0[1-9]|[1-3][0-9]|40)$"
        },
        "to": {
          "type": "string",
          "pattern": "^(0[1-9]|[12][0-9]|3[0-2])(0[1-9]|[1-3][0-9]|40)$"
        },
        "distance": {
          "description": "The jump distance in parsecs. The jump routes table states a target only at 1 through 4, so no route exists beyond four hexes.",
          "type": "integer",
          "minimum": 1,
          "maximum": 4
        }
      }
    }
  }
}
