{
  "schema_version": 1,
  "ruleset": "ct-1977-book3-pp1-12",
  "engine_version": "0",
  "rng_algorithm": "go-math-rand-v2-pcg",
  "seed": 1,
  "errata": [
    "E001",
    "E002",
    "E003",
    "E004",
    "E005"
  ],
  "name": "Aramis",
  "occurrence_dm": 1,
  "worlds": [
    {
      "hex": "0101",
      "name": "",
      "starport": "B",
      "naval_base": true,
      "scout_base": true,
      "size": 6,
      "atmosphere": 3,
      "hydrographics": 1,
      "population": 6,
      "government": 5,
      "law_level": 10,
      "tech_index": 8,
      "digits": "B63165A8"
    },
    {
      "hex": "0103",
      "name": "",
      "starport": "C",
      "naval_base": false,
      "scout_base": false,
      "size": 4,
      "atmosphere": 0,
      "hydrographics": 0,
      "population": 5,
      "government": 6,
      "law_level": 3,
      "tech_index": 8,
      "digits": "C4005638",
      "clamps": [
        {
          "characteristic": "hydrographics",
          "raw": -2,
          "value": 0
        }
      ]
    },
    {
      "hex": "0104",
      "name": "",
      "starport": "B",
      "naval_base": false,
      "scout_base": false,
      "size": 4,
      "atmosphere": 0,
      "hydrographics": 0,
      "population": 5,
      "government": 5,
      "law_level": 1,
      "tech_index": 9,
      "digits": "B4005519",
      "clamps": [
        {
          "characteristic": "hydrographics",
          "raw": -3,
          "value": 0
        }
      ]
    },
    {
      "hex": "0106",
      "name": "",
      "starport": "C",
      "naval_base": false,
      "scout_base": false,
      "size": 6,
      "atmosphere": 3,
      "hydrographics": 2,
      "population": 3,
      "government": 6,
      "law_level": 6,
      "tech_index": 7,
      "digits": "C6323667"
    },
    {
      "hex": "0107",
      "name": "",
      "starport": "A",
      "naval_base": false,
      "scout_base": false,
      "size": 9,
      "atmosphere": 8,
      "hydrographics": 7,
      "population": 8,
      "government": 7,
      "law_level": 6,
      "tech_index": 9,
      "digits": "A9878769"
    },
    {
      "hex": "0109",
      "name": "",
      "starport": "C",
      "naval_base": false,
      "scout_base": false,
      "size": 5,
      "atmosphere": 4,
      "hydrographics": 1,
      "population": 2,
      "government": 2,
      "law_level": 0,
      "tech_index": 6,
      "digits": "C5412206",
      "clamps": [
        {
          "characteristic": "law_level",
          "raw": -1,
          "value": 0
        }
      ]
    },
    {
      "hex": "0201",
      "name": "",
      "starport": "E",
      "naval_base": false,
      "scout_base": false,
      "size": 6,
      "atmosphere": 7,
      "hydrographics": 8,
      "population": 9,
      "government": 10,
      "law_level": 11,
      "tech_index": 6,
      "digits": "E6789AB6"
    },
    {
      "hex": "0202",
      "name": "",
      "starport": "D",
      "naval_base": false,
      "scout_base": true,
      "size": 8,
      "atmosphere": 3,
      "hydrographics": 8,
      "population": 9,
      "government": 9,
      "law_level": 7,
      "tech_index": 7,
      "digits": "D8389977"
    },
    {
      "hex": "0203",
      "name": "",
      "starport": "E",
      "naval_base": false,
      "scout_base": false,
      "size": 8,
      "atmosphere": 7,
      "hydrographics": 4,
      "population": 5,
      "government": 9,
      "law_level": 14,
      "tech_index": 2,
      "digits": "E87459E2"
    },
    {
      "hex": "0204",
      "name": "",
      "starport": "B",
      "naval_base": false,
      "scout_base": false,
      "size": 9,
      "atmosphere": 7,
      "hydrographics": 4,
      "population": 5,
      "government": 4,
      "law_level": 2,
      "tech_index": 10,
      "digits": "B974542A"
    },
    {
      "hex": "0206",
      "name": "",
      "starport": "E",
      "naval_base": false,
      "scout_base": false,
      "size": 9,
      "atmosphere": 4,
      "hydrographics": 14,
      "population": 9,
      "government": 11,
      "law_level": 7,
      "tech_index": 4,
      "digits": "E94E9B74"
    },
    {
      "hex": "0209",
      "name": "",
      "starport": "E",
      "naval_base": false,
      "scout_base": false,
      "size": 3,
      "atmosphere": 3,
      "hydrographics": 8,
      "population": 4,
      "government": 2,
      "law_level": 0,
      "tech_index": 7,
      "digits": "E3384207"
    },
    {
      "hex": "0302",
      "name": "",
      "starport": "B",
      "naval_base": false,
      "scout_base": false,
      "size": 2,
      "atmosphere": 0,
      "hydrographics": 0,
      "population": 3,
      "government": 0,
      "law_level": 0,
      "tech_index": 11,
      "digits": "B200300B",
      "clamps": [
        {
          "characteristic": "government",
          "raw": -1,
          "value": 0
        },
        {
          "characteristic": "law_level",
          "raw": -3,
          "value": 0
        }
      ]
    },
    {
      "hex": "0303",
      "name": "",
      "starport": "A",
      "naval_base": false,
      "scout_base": false,
      "size": 0,
      "atmosphere": 0,
      "hydrographics": 0,
      "population": 7,
      "government": 9,
      "law_level": 8,
      "tech_index": 15,
      "digits": "A000798F"
    },
    {
      "hex": "0305",
      "name": "",
      "starport": "C",
      "naval_base": false,
      "scout_base": false,
      "size": 1,
      "atmosphere": 0,
      "hydrographics": 0,
      "population": 6,
      "government": 5,
      "law_level": 4,
      "tech_index": 9,
      "digits": "C1006549",
      "clamps": [
        {
          "characteristic": "atmosphere",
          "raw": -1,
          "value": 0
        }
      ]
    },
    {
      "hex": "0306",
      "name": "",
      "starport": "B",
      "naval_base": false,
      "scout_base": false,
      "size": 4,
      "atmosphere": 3,
      "hydrographics": 8,
      "population": 1,
      "government": 0,
      "law_level": 0,
      "tech_index": 14,
      "digits": "B438100E",
      "clamps": [
        {
          "characteristic": "government",
          "raw": -2,
          "value": 0
        },
        {
          "characteristic": "law_level",
          "raw": -4,
          "value": 0
        }
      ]
    },
    {
      "hex": "0307",
      "name": "",
      "starport": "B",
      "naval_base": true,
      "scout_base": true,
      "size": 5,
      "atmosphere": 3,
      "hydrographics": 3,
      "population": 6,
      "government": 4,
      "law_level": 3,
      "tech_index": 8,
      "digits": "B5336438"
    },
    {
      "hex": "0309",
      "name": "",
      "starport": "C",
      "naval_base": false,
      "scout_base": false,
      "size": 5,
      "atmosphere": 6,
      "hydrographics": 3,
      "population": 5,
      "government": 7,
      "law_level": 5,
      "tech_index": 8,
      "digits": "C5635758"
    },
    {
      "hex": "0401",
      "name": "",
      "starport": "E",
      "naval_base": false,
      "scout_base": false,
      "size": 3,
      "atmosphere": 3,
      "hydrographics": 7,
      "population": 4,
      "government": 3,
      "law_level": 5,
      "tech_index": 9,
      "digits": "E3374359"
    },
    {
      "hex": "0405",
      "name": "",
      "starport": "C",
      "naval_base": false,
      "scout_base": false,
      "size": 4,
      "atmosphere": 3,
      "hydrographics": 8,
      "population": 5,
      "government": 6,
      "law_level": 6,
      "tech_index": 7,
      "digits": "C4385667"
    },
    {
      "hex": "0406",
      "name": "",
      "starport": "B",
      "naval_base": false,
      "scout_base": true,
      "size": 1,
      "atmosphere": 1,
      "hydrographics": 0,
      "population": 5,
      "government": 6,
      "law_level": 6,
      "tech_index": 14,
      "digits": "B110566E"
    },
    {
      "hex": "0407",
      "name": "",
      "starport": "D",
      "naval_base": false,
      "scout_base": false,
      "size": 6,
      "atmosphere": 4,
      "hydrographics": 6,
      "population": 6,
      "government": 4,
      "law_level": 5,
      "tech_index": 5,
      "digits": "D6466455"
    },
    {
      "hex": "0409",
      "name": "",
      "starport": "B",
      "naval_base": false,
      "scout_base": false,
      "size": 5,
      "atmosphere": 5,
      "hydrographics": 3,
      "population": 8,
      "government": 12,
      "law_level": 8,
      "tech_index": 6,
      "digits": "B5538C86"
    },
    {
      "hex": "0501",
      "name": "",
      "starport": "A",
      "naval_base": false,
      "scout_base": false,
      "size": 3,
      "atmosphere": 1,
      "hydrographics": 0,
      "population": 1,
      "government": 0,
      "law_level": 2,
      "tech_index": 13,
      "digits": "A310102D",
      "clamps": [
        {
          "characteristic": "hydrographics",
          "raw": -4,
          "value": 0
        },
        {
          "characteristic": "government",
          "raw": -4,
          "value": 0
        }
      ]
    },
    {
      "hex": "0502",
      "name": "",
      "starport": "B",
      "naval_base": true,
      "scout_base": false,
      "size": 1,
      "atmosphere": 4,
      "hydrographics": 0,
      "population": 5,
      "government": 8,
      "law_level": 7,
      "tech_index": 10,
      "digits": "B140587A"
    },
    {
      "hex": "0505",
      "name": "",
      "starport": "B",
      "naval_base": false,
      "scout_base": true,
      "size": 9,
      "atmosphere": 11,
      "hydrographics": 7,
      "population": 9,
      "government": 9,
      "law_level": 7,
      "tech_index": 9,
      "digits": "B9B79979"
    },
    {
      "hex": "0506",
      "name": "",
      "starport": "C",
      "naval_base": false,
      "scout_base": false,
      "size": 4,
      "atmosphere": 8,
      "hydrographics": 8,
      "population": 2,
      "government": 7,
      "law_level": 4,
      "tech_index": 6,
      "digits": "C4882746"
    },
    {
      "hex": "0507",